id,ticker,created_at,full_text_preprocessed,user.verified,favorite_count,retweet_count,quality,entities.symbols,num_cashtags,query_params
1511131058506506244,$GME,Mon Apr 04 23:58:14 +0000 2022,probably because he is a living legend and taking gme to the moon,False,1,0,False,"[{'text': 'GME', 'indices': [74, 78]}]",1,query:$GME -$TSLA -$TWTR -$AMC -$SPY -$HMHC -$DWAC -$AMD -$SST -$AAPL -$AMZN -$NVDA -$TLRY -$NFLX -$QQQ -filter:retweets since_id:1510769113282580484 until_date:2022-04-05 max_tweets:10
1511129351344975876,$GME,Mon Apr 04 23:51:27 +0000 2022,she had a not so great week a couple weeks ago shes got a lot of school stuff going on is focused on it for now gotta stay she moved all of her remaining balance into gme go figure  amp is just sitting tight for now shell start trading again once summer comes around,False,0,0,False,"[{'text': 'GME', 'indices': [190, 194]}]",1,query:$GME -$TSLA -$TWTR -$AMC -$SPY -$HMHC -$DWAC -$AMD -$SST -$AAPL -$AMZN -$NVDA -$TLRY -$NFLX -$QQQ -filter:retweets since_id:1510769113282580484 until_date:2022-04-05 max_tweets:10
1511128081213235204,$GME,Mon Apr 04 23:46:24 +0000 2022,an rplace gme story in four parts dont cry because its over smile because it happened dr seuss,False,109,13,True,"[{'text': 'GME', 'indices': [11, 15]}]",1,query:$GME -$TSLA -$TWTR -$AMC -$SPY -$HMHC -$DWAC -$AMD -$SST -$AAPL -$AMZN -$NVDA -$TLRY -$NFLX -$QQQ -filter:retweets since_id:1510769113282580484 until_date:2022-04-05 max_tweets:10
1511127876774637571,$GME,Mon Apr 04 23:45:35 +0000 2022,no ones selling gme for  can we put a stop to spoofingbotting and illegal naked short selling,False,0,0,False,"[{'text': 'gme', 'indices': [19, 23]}]",1,query:$GME -$TSLA -$TWTR -$AMC -$SPY -$HMHC -$DWAC -$AMD -$SST -$AAPL -$AMZN -$NVDA -$TLRY -$NFLX -$QQQ -filter:retweets since_id:1510769113282580484 until_date:2022-04-05 max_tweets:10
1511127433751281670,$GME,Mon Apr 04 23:43:50 +0000 2022,tweet you like the stock gme,False,0,0,False,"[{'text': 'GME', 'indices': [30, 34]}]",1,query:$GME -$TSLA -$TWTR -$AMC -$SPY -$HMHC -$DWAC -$AMD -$SST -$AAPL -$AMZN -$NVDA -$TLRY -$NFLX -$QQQ -filter:retweets since_id:1510769113282580484 until_date:2022-04-05 max_tweets:10
1511126191113228293,$GME,Mon Apr 04 23:38:53 +0000 2022,whut is this spread in my tradingview gme,False,12,0,False,"[{'text': 'GME', 'indices': [43, 47]}]",1,query:$GME -$TSLA -$TWTR -$AMC -$SPY -$HMHC -$DWAC -$AMD -$SST -$AAPL -$AMZN -$NVDA -$TLRY -$NFLX -$QQQ -filter:retweets since_id:1510769113282580484 until_date:2022-04-05 max_tweets:10
1511125541616852998,$GME,Mon Apr 04 23:36:19 +0000 2022,im long gme nincompoop,False,0,0,False,"[{'text': 'GME', 'indices': [32, 36]}]",1,query:$GME -$TSLA -$TWTR -$AMC -$SPY -$HMHC -$DWAC -$AMD -$SST -$AAPL -$AMZN -$NVDA -$TLRY -$NFLX -$QQQ -filter:retweets since_id:1510769113282580484 until_date:2022-04-05 max_tweets:10
1511125490970546177,$GME,Mon Apr 04 23:36:07 +0000 2022,if hes still hard then im still hard gme,False,26,0,False,"[{'text': 'GME', 'indices': [40, 44]}]",1,query:$GME -$TSLA -$TWTR -$AMC -$SPY -$HMHC -$DWAC -$AMD -$SST -$AAPL -$AMZN -$NVDA -$TLRY -$NFLX -$QQQ -filter:retweets since_id:1510769113282580484 until_date:2022-04-05 max_tweets:10
1511124141675618311,$GME,Mon Apr 04 23:30:45 +0000 2022,all that you need to know lrc gme loopring x gamestop nft marketplace bring it already,False,1,2,False,"[{'text': 'LRC', 'indices': [26, 30]}, {'text': 'GME', 'indices': [31, 35]}]",2,query:$GME -$TSLA -$TWTR -$AMC -$SPY -$HMHC -$DWAC -$AMD -$SST -$AAPL -$AMZN -$NVDA -$TLRY -$NFLX -$QQQ -filter:retweets since_id:1510769113282580484 until_date:2022-04-05 max_tweets:10
1511123804222750729,$GME,Mon Apr 04 23:29:24 +0000 2022,this should make everyone mad and if you support this bullshit youre a part of the problem mother fucker gme,False,1,0,False,"[{'text': 'GME', 'indices': [108, 112]}]",1,query:$GME -$TSLA -$TWTR -$AMC -$SPY -$HMHC -$DWAC -$AMD -$SST -$AAPL -$AMZN -$NVDA -$TLRY -$NFLX -$QQQ -filter:retweets since_id:1510769113282580484 until_date:2022-04-05 max_tweets:10
1511130963048386560,$TSLA,Mon Apr 04 23:57:51 +0000 2022,tsla is the long or short of our lifetime i dont fucking know which either  thank you and goodnight ,False,1,0,False,"[{'text': 'tsla', 'indices': [0, 5]}]",1,query:$TSLA -$GME -$TWTR -$AMC -$SPY -$HMHC -$DWAC -$AMD -$SST -$AAPL -$AMZN -$NVDA -$TLRY -$NFLX -$QQQ -filter:retweets since_id:1510769113282580484 until_date:2022-04-05 max_tweets:10
1511130692171620353,$TSLA,Mon Apr 04 23:56:47 +0000 2022,vix breakdown on diagnol support level however it could bounce in this weekimo reason  macro event  wed  fomcmarch meeting minutes  thur  tsla is scheduled on big eventsell the news,False,0,0,False,"[{'text': 'VIX', 'indices': [0, 4]}, {'text': 'TSLA', 'indices': [166, 171]}]",2,query:$TSLA -$GME -$TWTR -$AMC -$SPY -$HMHC -$DWAC -$AMD -$SST -$AAPL -$AMZN -$NVDA -$TLRY -$NFLX -$QQQ -filter:retweets since_id:1510769113282580484 until_date:2022-04-05 max_tweets:10
1511130468388950021,$TSLA,Mon Apr 04 23:55:53 +0000 2022,buying tsla on the dip at ,False,4,0,False,"[{'text': 'TSLA', 'indices': [21, 26]}]",1,query:$TSLA -$GME -$TWTR -$AMC -$SPY -$HMHC -$DWAC -$AMD -$SST -$AAPL -$AMZN -$NVDA -$TLRY -$NFLX -$QQQ -filter:retweets since_id:1510769113282580484 until_date:2022-04-05 max_tweets:10
1511130362281295872,$TSLA,Mon Apr 04 23:55:28 +0000 2022,doing on the streets all day hard to know how fast youre going its more than a  car very linear power delivery drive it if you can highly recommendedbest handling  fun evs taycan mini ev bmw i mrs etron gt tsla,False,4,0,False,"[{'text': 'TSLA', 'indices': [245, 250]}]",1,query:$TSLA -$GME -$TWTR -$AMC -$SPY -$HMHC -$DWAC -$AMD -$SST -$AAPL -$AMZN -$NVDA -$TLRY -$NFLX -$QQQ -filter:retweets since_id:1510769113282580484 until_date:2022-04-05 max_tweets:10
1511130342454792193,$TSLA,Mon Apr 04 23:55:23 +0000 2022,fun factor is off the chartsits between the taycan turbo amp the mini se ev for handling nimble fast handles on rails till you hit over mpg on curves then you feel the weightundersteer takes bumps really well smooth yet sporty tsla,False,2,0,False,"[{'text': 'TSLA', 'indices': [257, 262]}]",1,query:$TSLA -$GME -$TWTR -$AMC -$SPY -$HMHC -$DWAC -$AMD -$SST -$AAPL -$AMZN -$NVDA -$TLRY -$NFLX -$QQQ -filter:retweets since_id:1510769113282580484 until_date:2022-04-05 max_tweets:10
1511130323244834820,$TSLA,Mon Apr 04 23:55:19 +0000 2022,drove the i m fun amp exhilarating must driveso much torque that it was hard to keep traction on launch amp while driving not sure if you can hear the growl amp rumble on the launchit comes alive over mph definitely made for the autobahn tsla,False,6,0,False,"[{'text': 'TSLA', 'indices': [278, 283]}]",1,query:$TSLA -$GME -$TWTR -$AMC -$SPY -$HMHC -$DWAC -$AMD -$SST -$AAPL -$AMZN -$NVDA -$TLRY -$NFLX -$QQQ -filter:retweets since_id:1510769113282580484 until_date:2022-04-05 max_tweets:10
1511130293096239107,$TSLA,Mon Apr 04 23:55:11 +0000 2022,i love you guys so much youre the best friends a girl could ask for tsla,False,0,0,False,"[{'text': 'TSLA', 'indices': [122, 127]}]",1,query:$TSLA -$GME -$TWTR -$AMC -$SPY -$HMHC -$DWAC -$AMD -$SST -$AAPL -$AMZN -$NVDA -$TLRY -$NFLX -$QQQ -filter:retweets since_id:1510769113282580484 until_date:2022-04-05 max_tweets:10
1511130292723060739,$TSLA,Mon Apr 04 23:55:11 +0000 2022,tsla make amazing profit in the shortest time possiblefastest payout system friendly live supportdont miss this opportunity click on the link and join,False,0,0,False,"[{'text': 'TSLA', 'indices': [0, 5]}]",1,query:$TSLA -$GME -$TWTR -$AMC -$SPY -$HMHC -$DWAC -$AMD -$SST -$AAPL -$AMZN -$NVDA -$TLRY -$NFLX -$QQQ -filter:retweets since_id:1510769113282580484 until_date:2022-04-05 max_tweets:10
1511130230706032645,$TSLA,Mon Apr 04 23:54:57 +0000 2022,freedom stocks watchlist for tomorrow tslaxpevggpilcidnio,False,0,0,False,"[{'text': 'TSLA', 'indices': [45, 50]}, {'text': 'XPEV', 'indices': [51, 56]}, {'text': 'GGPI', 'indices': [57, 62]}, {'text': 'LCID', 'indices': [63, 68]}, {'text': 'NIO', 'indices': [69, 73]}]",5,query:$TSLA -$GME -$TWTR -$AMC -$SPY -$HMHC -$DWAC -$AMD -$SST -$AAPL -$AMZN -$NVDA -$TLRY -$NFLX -$QQQ -filter:retweets since_id:1510769113282580484 until_date:2022-04-05 max_tweets:10
1511130225798696962,$TSLA,Mon Apr 04 23:54:55 +0000 2022,totally underappreciated even by tsla owners let alone tslaq fudsters,False,2,0,False,"[{'text': 'TSLA', 'indices': [33, 38]}, {'text': 'TSLAQ', 'indices': [56, 62]}]",2,query:$TSLA -$GME -$TWTR -$AMC -$SPY -$HMHC -$DWAC -$AMD -$SST -$AAPL -$AMZN -$NVDA -$TLRY -$NFLX -$QQQ -filter:retweets since_id:1510769113282580484 until_date:2022-04-05 max_tweets:10
1511131498296053767,$TWTR,Mon Apr 04 23:59:59 +0000 2022,twtr hope kills the short sellers on this one,False,1,0,False,"[{'text': 'TWTR', 'indices': [0, 5]}]",1,query:$TWTR -$GME -$TSLA -$AMC -$SPY -$HMHC -$DWAC -$AMD -$SST -$AAPL -$AMZN -$NVDA -$TLRY -$NFLX -$QQQ -filter:retweets since_id:1510769113282580484 until_date:2022-04-05 max_tweets:10
1511131484207579138,$TWTR,Mon Apr 04 23:59:55 +0000 2022,tesla offbalance sheet loans to fund twtr lbo till i die,False,0,0,False,"[{'text': 'TWTR', 'indices': [47, 52]}]",1,query:$TWTR -$GME -$TSLA -$AMC -$SPY -$HMHC -$DWAC -$AMD -$SST -$AAPL -$AMZN -$NVDA -$TLRY -$NFLX -$QQQ -filter:retweets since_id:1510769113282580484 until_date:2022-04-05 max_tweets:10
1511131456634040322,$TWTR,Mon Apr 04 23:59:49 +0000 2022,i bet you that all is planning to do at  is to just fire a few people and then offload twtr,False,0,0,False,"[{'text': 'TWTR', 'indices': [108, 113]}]",1,query:$TWTR -$GME -$TSLA -$AMC -$SPY -$HMHC -$DWAC -$AMD -$SST -$AAPL -$AMZN -$NVDA -$TLRY -$NFLX -$QQQ -filter:retweets since_id:1510769113282580484 until_date:2022-04-05 max_tweets:10
1511131310953099266,$TWTR,Mon Apr 04 23:59:14 +0000 2022,twtr time to give trump his account back,False,0,0,False,"[{'text': 'twtr', 'indices': [0, 5]}]",1,query:$TWTR -$GME -$TSLA -$AMC -$SPY -$HMHC -$DWAC -$AMD -$SST -$AAPL -$AMZN -$NVDA -$TLRY -$NFLX -$QQQ -filter:retweets since_id:1510769113282580484 until_date:2022-04-05 max_tweets:10
1511131308604502020,$TWTR,Mon Apr 04 23:59:14 +0000 2022,elon musk was named time magazine person of the year that means hes really influential  he can change things without directly touching them i think he will improve twtr in the long run this is a very interesting topic worth a continual conversation,False,1,0,False,"[{'text': 'TWTR', 'indices': [182, 187]}]",1,query:$TWTR -$GME -$TSLA -$AMC -$SPY -$HMHC -$DWAC -$AMD -$SST -$AAPL -$AMZN -$NVDA -$TLRY -$NFLX -$QQQ -filter:retweets since_id:1510769113282580484 until_date:2022-04-05 max_tweets:10
1511131243353714694,$TWTR,Mon Apr 04 23:58:58 +0000 2022,trying to imagine what a world with twitterlink may look like twtr,False,0,0,False,"[{'text': 'TWTR', 'indices': [66, 71]}]",1,query:$TWTR -$GME -$TSLA -$AMC -$SPY -$HMHC -$DWAC -$AMD -$SST -$AAPL -$AMZN -$NVDA -$TLRY -$NFLX -$QQQ -filter:retweets since_id:1510769113282580484 until_date:2022-04-05 max_tweets:10
1511131162227273733,$TWTR,Mon Apr 04 23:58:39 +0000 2022, twtr,False,3,0,False,"[{'text': 'TWTR', 'indices': [18, 23]}]",1,query:$TWTR -$GME -$TSLA -$AMC -$SPY -$HMHC -$DWAC -$AMD -$SST -$AAPL -$AMZN -$NVDA -$TLRY -$NFLX -$QQQ -filter:retweets since_id:1510769113282580484 until_date:2022-04-05 max_tweets:10
1511131066928615433,$TWTR,Mon Apr 04 23:58:16 +0000 2022,probably the best founder the world has ever seen has spent fuckin billion  of his hard earned money to make the company better amp not a single congratulatorywelcome tweet welcoming him as a shareholder from jackparag nedwhat a bunch of clowns is twtr filled with ,False,7,0,False,"[{'text': 'TWTR', 'indices': [259, 264]}]",1,query:$TWTR -$GME -$TSLA -$AMC -$SPY -$HMHC -$DWAC -$AMD -$SST -$AAPL -$AMZN -$NVDA -$TLRY -$NFLX -$QQQ -filter:retweets since_id:1510769113282580484 until_date:2022-04-05 max_tweets:10
1511130806584070147,$TWTR,Mon Apr 04 23:57:14 +0000 2022,breaking news twtr futures static to start week atax tcbp avlcc ater via,False,0,0,False,"[{'text': 'TWTR', 'indices': [15, 20]}, {'text': 'ATAX', 'indices': [130, 135]}, {'text': 'TCBP', 'indices': [136, 141]}, {'text': 'AVL', 'indices': [142, 146]}, {'text': 'ATER', 'indices': [150, 155]}]",5,query:$TWTR -$GME -$TSLA -$AMC -$SPY -$HMHC -$DWAC -$AMD -$SST -$AAPL -$AMZN -$NVDA -$TLRY -$NFLX -$QQQ -filter:retweets since_id:1510769113282580484 until_date:2022-04-05 max_tweets:10
1511130783473442819,$TWTR,Mon Apr 04 23:57:08 +0000 2022,consolidated markets top mostshorted stocks based on share volume not dollar value twtr shares  plx shares  sndl shares  ,False,3,0,False,"[{'text': 'TWTR', 'indices': [90, 95]}, {'text': 'PLX', 'indices': [117, 121]}, {'text': 'SNDL', 'indices': [143, 148]}]",3,query:$TWTR -$GME -$TSLA -$AMC -$SPY -$HMHC -$DWAC -$AMD -$SST -$AAPL -$AMZN -$NVDA -$TLRY -$NFLX -$QQQ -filter:retweets since_id:1510769113282580484 until_date:2022-04-05 max_tweets:10
1511131303541805059,$AMC,Mon Apr 04 23:59:12 +0000 2022,my thoughts on amcwere still accumulating and have maintained our launch pad zone a drop beneath  amp id turn bearish though that is unlikely we are going to retest the order block at  soon a breakout there will quickly lead to some fireworks,False,2,0,False,"[{'text': 'AMC', 'indices': [15, 19]}]",1,query:$AMC -$GME -$TSLA -$TWTR -$SPY -$HMHC -$DWAC -$AMD -$SST -$AAPL -$AMZN -$NVDA -$TLRY -$NFLX -$QQQ -filter:retweets since_id:1510769113282580484 until_date:2022-04-05 max_tweets:10
1511131194187997189,$AMC,Mon Apr 04 23:58:46 +0000 2022,afterhours ta is hard how am i supposed to predict which side of the barcode amc will sit on for the next minutes,False,2,0,False,"[{'text': 'AMC', 'indices': [78, 82]}]",1,query:$AMC -$GME -$TSLA -$TWTR -$SPY -$HMHC -$DWAC -$AMD -$SST -$AAPL -$AMZN -$NVDA -$TLRY -$NFLX -$QQQ -filter:retweets since_id:1510769113282580484 until_date:2022-04-05 max_tweets:10
1511130949181972485,$AMC,Mon Apr 04 23:57:48 +0000 2022,every other ta has been wrong so far for amc unless they post more than one scenario and one of them eventually plays out as you said im not backing you up here or calling out others it just proves that manipulation plays a bigger role in some stocks like and,False,2,0,False,"[{'text': 'AMC', 'indices': [58, 62]}]",1,query:$AMC -$GME -$TSLA -$TWTR -$SPY -$HMHC -$DWAC -$AMD -$SST -$AAPL -$AMZN -$NVDA -$TLRY -$NFLX -$QQQ -filter:retweets since_id:1510769113282580484 until_date:2022-04-05 max_tweets:10
1511129624545177601,$AMC,Mon Apr 04 23:52:32 +0000 2022,amc avg age of short per ortex is days jan th the price was between and  on average m shares are  with ctb highest point since july and consecutive days of  utilization,False,21,4,False,"[{'text': 'AMC', 'indices': [0, 4]}]",1,query:$AMC -$GME -$TSLA -$TWTR -$SPY -$HMHC -$DWAC -$AMD -$SST -$AAPL -$AMZN -$NVDA -$TLRY -$NFLX -$QQQ -filter:retweets since_id:1510769113282580484 until_date:2022-04-05 max_tweets:10
1511129565653000194,$AMC,Mon Apr 04 23:52:18 +0000 2022,i think hymc was a huge distraction for amc,False,0,0,False,"[{'text': 'HYMC', 'indices': [8, 13]}, {'text': 'AMC', 'indices': [41, 45]}]",2,query:$AMC -$GME -$TSLA -$TWTR -$SPY -$HMHC -$DWAC -$AMD -$SST -$AAPL -$AMZN -$NVDA -$TLRY -$NFLX -$QQQ -filter:retweets since_id:1510769113282580484 until_date:2022-04-05 max_tweets:10
1511129466440982529,$AMC,Mon Apr 04 23:51:54 +0000 2022,amc idk why yall keep saying trust me bro to an indicator,False,30,0,False,"[{'text': 'amc', 'indices': [0, 4]}]",1,query:$AMC -$GME -$TSLA -$TWTR -$SPY -$HMHC -$DWAC -$AMD -$SST -$AAPL -$AMZN -$NVDA -$TLRY -$NFLX -$QQQ -filter:retweets since_id:1510769113282580484 until_date:2022-04-05 max_tweets:10
1511129090845286404,$AMC,Mon Apr 04 23:50:25 +0000 2022,the most useless info for a stock amc the waste of time youll never get back in your life chasing a company with no potential,False,0,0,False,"[{'text': 'AMC', 'indices': [51, 55]}]",1,query:$AMC -$GME -$TSLA -$TWTR -$SPY -$HMHC -$DWAC -$AMD -$SST -$AAPL -$AMZN -$NVDA -$TLRY -$NFLX -$QQQ -filter:retweets since_id:1510769113282580484 until_date:2022-04-05 max_tweets:10
1511128984423129088,$AMC,Mon Apr 04 23:49:59 +0000 2022,some really good looking females like amc,False,0,0,False,"[{'text': 'AMC', 'indices': [51, 55]}]",1,query:$AMC -$GME -$TSLA -$TWTR -$SPY -$HMHC -$DWAC -$AMD -$SST -$AAPL -$AMZN -$NVDA -$TLRY -$NFLX -$QQQ -filter:retweets since_id:1510769113282580484 until_date:2022-04-05 max_tweets:10
1511128749995143176,$AMC,Mon Apr 04 23:49:04 +0000 2022,interesting amc,False,3,1,False,"[{'text': 'amc', 'indices': [17, 21]}]",1,query:$AMC -$GME -$TSLA -$TWTR -$SPY -$HMHC -$DWAC -$AMD -$SST -$AAPL -$AMZN -$NVDA -$TLRY -$NFLX -$QQQ -filter:retweets since_id:1510769113282580484 until_date:2022-04-05 max_tweets:10
1511128584894615554,$AMC,Mon Apr 04 23:48:24 +0000 2022, agree this guy would be nothing without the amc community recognize the game,False,1,0,False,"[{'text': 'AMC', 'indices': [60, 64]}]",1,query:$AMC -$GME -$TSLA -$TWTR -$SPY -$HMHC -$DWAC -$AMD -$SST -$AAPL -$AMZN -$NVDA -$TLRY -$NFLX -$QQQ -filter:retweets since_id:1510769113282580484 until_date:2022-04-05 max_tweets:10
1511131497842941955,$SPY,Mon Apr 04 23:59:59 +0000 2022,shooting for k in profits this week spy spx,False,0,0,False,"[{'text': 'SPY', 'indices': [40, 44]}, {'text': 'SPX', 'indices': [45, 49]}]",2,query:$SPY -$GME -$TSLA -$TWTR -$AMC -$HMHC -$DWAC -$AMD -$SST -$AAPL -$AMZN -$NVDA -$TLRY -$NFLX -$QQQ -filter:retweets since_id:1510769113282580484 until_date:2022-04-05 max_tweets:10
1511131427173195784,$SPY,Mon Apr 04 23:59:42 +0000 2022, watchlist sbux calls gt puts lt msft calls gt puts lt spy calls gt puts lt f calls gt puts lt,False,5,0,False,"[{'text': 'SBUX', 'indices': [19, 24]}, {'text': 'MSFT', 'indices': [58, 63]}, {'text': 'SPY', 'indices': [96, 100]}, {'text': 'F', 'indices': [133, 135]}]",4,query:$SPY -$GME -$TSLA -$TWTR -$AMC -$HMHC -$DWAC -$AMD -$SST -$AAPL -$AMZN -$NVDA -$TLRY -$NFLX -$QQQ -filter:retweets since_id:1510769113282580484 until_date:2022-04-05 max_tweets:10
1511131422744059913,$SPY,Mon Apr 04 23:59:41 +0000 2022,spy by friday no risk,False,2,0,False,"[{'text': 'SPY', 'indices': [0, 4]}]",1,query:$SPY -$GME -$TSLA -$TWTR -$AMC -$HMHC -$DWAC -$AMD -$SST -$AAPL -$AMZN -$NVDA -$TLRY -$NFLX -$QQQ -filter:retweets since_id:1510769113282580484 until_date:2022-04-05 max_tweets:10
1511131395279626245,$SPY,Mon Apr 04 23:59:34 +0000 2022,es spy spx  technical rebound leading to fed minutes on wednesdayresistance   green zonesupport   yellow zone,False,3,0,False,"[{'text': 'ES', 'indices': [0, 3]}, {'text': 'SPY', 'indices': [4, 8]}, {'text': 'SPX', 'indices': [9, 13]}]",3,query:$SPY -$GME -$TSLA -$TWTR -$AMC -$HMHC -$DWAC -$AMD -$SST -$AAPL -$AMZN -$NVDA -$TLRY -$NFLX -$QQQ -filter:retweets since_id:1510769113282580484 until_date:2022-04-05 max_tweets:10
1511131174655041538,$SPY,Mon Apr 04 23:58:42 +0000 2022,perspective is great i could not disagree with this more tend to your mental physical spiritual health before even thinking about your financial health dont be a sleepy dirty ass dirty mouth oh hey lemme coin flip spy trader have some fucking respect for yourself,False,1,0,False,"[{'text': 'SPY', 'indices': [226, 230]}]",1,query:$SPY -$GME -$TSLA -$TWTR -$AMC -$HMHC -$DWAC -$AMD -$SST -$AAPL -$AMZN -$NVDA -$TLRY -$NFLX -$QQQ -filter:retweets since_id:1510769113282580484 until_date:2022-04-05 max_tweets:10
1511131094791372801,$SPY,Mon Apr 04 23:58:23 +0000 2022,also if most money of they day went into faangs spy would have little volume all the money went elsewhere but spy would move with little volume to reflect changes of those individual constituents,False,2,0,False,"[{'text': 'SPY', 'indices': [66, 70]}, {'text': 'SPY', 'indices': [132, 136]}]",2,query:$SPY -$GME -$TSLA -$TWTR -$AMC -$HMHC -$DWAC -$AMD -$SST -$AAPL -$AMZN -$NVDA -$TLRY -$NFLX -$QQQ -filter:retweets since_id:1510769113282580484 until_date:2022-04-05 max_tweets:10
1511130840016863239,$SPY,Mon Apr 04 23:57:22 +0000 2022,spy stocks typically move north in april and it is historically the best month of the year for the samp  the samp has been higher  of the time and has gained an average  in all aprils since world war ii according to sam stovall,False,9,2,False,"[{'text': 'SPY', 'indices': [0, 4]}]",1,query:$SPY -$GME -$TSLA -$TWTR -$AMC -$HMHC -$DWAC -$AMD -$SST -$AAPL -$AMZN -$NVDA -$TLRY -$NFLX -$QQQ -filter:retweets since_id:1510769113282580484 until_date:2022-04-05 max_tweets:10
1511130776745783297,$SPY,Mon Apr 04 23:57:07 +0000 2022,short spyholding period max days,False,0,0,False,"[{'text': 'SPY', 'indices': [19, 23]}]",1,query:$SPY -$GME -$TSLA -$TWTR -$AMC -$HMHC -$DWAC -$AMD -$SST -$AAPL -$AMZN -$NVDA -$TLRY -$NFLX -$QQQ -filter:retweets since_id:1510769113282580484 until_date:2022-04-05 max_tweets:10
1511130588933201923,$SPY,Mon Apr 04 23:56:22 +0000 2022,i think people forget that after a move up price tends to move sideways for a bit before another leg this is healthy price action spy,False,2,0,False,"[{'text': 'SPY', 'indices': [134, 138]}]",1,query:$SPY -$GME -$TSLA -$TWTR -$AMC -$HMHC -$DWAC -$AMD -$SST -$AAPL -$AMZN -$NVDA -$TLRY -$NFLX -$QQQ -filter:retweets since_id:1510769113282580484 until_date:2022-04-05 max_tweets:10
1511130518519259138,$SPY,Mon Apr 04 23:56:05 +0000 2022,short spyholding period max days,False,0,0,False,"[{'text': 'SPY', 'indices': [22, 26]}]",1,query:$SPY -$GME -$TSLA -$TWTR -$AMC -$HMHC -$DWAC -$AMD -$SST -$AAPL -$AMZN -$NVDA -$TLRY -$NFLX -$QQQ -filter:retweets since_id:1510769113282580484 until_date:2022-04-05 max_tweets:10
1511114647285424133,$HMHC,Mon Apr 04 22:53:01 +0000 2022,hmhc eog and dvn are amongst the strongest stocks in the market nearing a new high,False,0,0,False,"[{'text': 'HMHC', 'indices': [0, 5]}, {'text': 'EOG', 'indices': [7, 11]}, {'text': 'DVN', 'indices': [16, 20]}]",3,query:$HMHC -$GME -$TSLA -$TWTR -$AMC -$SPY -$DWAC -$AMD -$SST -$AAPL -$AMZN -$NVDA -$TLRY -$NFLX -$QQQ -filter:retweets since_id:1510769113282580484 until_date:2022-04-05 max_tweets:10
1511111017702604816,$HMHC,Mon Apr 04 22:38:36 +0000 2022,bkep  lowball takeout at  activists involved rr off the chartshmhc   lowball tender offer looks like it will get rejected and trade higher rr also v high,False,7,0,False,"[{'text': 'bkep', 'indices': [9, 14]}, {'text': 'hmhc', 'indices': [82, 87]}]",2,query:$HMHC -$GME -$TSLA -$TWTR -$AMC -$SPY -$DWAC -$AMD -$SST -$AAPL -$AMZN -$NVDA -$TLRY -$NFLX -$QQQ -filter:retweets since_id:1510769113282580484 until_date:2022-04-05 max_tweets:10
1511070931963240467,$HMHC,Mon Apr 04 19:59:19 +0000 2022,houghton mifflin harcourt company traded m shares  above average volume hmhc,False,1,0,False,"[{'text': 'HMHC', 'indices': [81, 86]}]",1,query:$HMHC -$GME -$TSLA -$TWTR -$AMC -$SPY -$DWAC -$AMD -$SST -$AAPL -$AMZN -$NVDA -$TLRY -$NFLX -$QQQ -filter:retweets since_id:1510769113282580484 until_date:2022-04-05 max_tweets:10
1511064557569118208,$HMHC,Mon Apr 04 19:33:59 +0000 2022,sums up the hmhc proposed sale beautifully i think this is the worst deal process ive ever seen i cant believe the board is trying to sell the company at this price given how flawed the projections were,False,19,3,False,"[{'text': 'HMHC', 'indices': [29, 34]}]",1,query:$HMHC -$GME -$TSLA -$TWTR -$AMC -$SPY -$DWAC -$AMD -$SST -$AAPL -$AMZN -$NVDA -$TLRY -$NFLX -$QQQ -filter:retweets since_id:1510769113282580484 until_date:2022-04-05 max_tweets:10
1511054563129933830,$HMHC,Mon Apr 04 18:54:16 +0000 2022,a quick note as hmhcs tender deadline approaches,False,21,5,False,"[{'text': 'HMHC', 'indices': [16, 21]}]",1,query:$HMHC -$GME -$TSLA -$TWTR -$AMC -$SPY -$DWAC -$AMD -$SST -$AAPL -$AMZN -$NVDA -$TLRY -$NFLX -$QQQ -filter:retweets since_id:1510769113282580484 until_date:2022-04-05 max_tweets:10
1511048477580607503,$HMHC,Mon Apr 04 18:30:05 +0000 2022, hmhc  bullish option flow detected in houghton mifflin   with calls trading x expected and implied vol increasing over points to   the putcall ratio is  earnings are expected on ,False,2,1,False,"[{'text': 'HMHC', 'indices': [9, 14]}]",1,query:$HMHC -$GME -$TSLA -$TWTR -$AMC -$SPY -$DWAC -$AMD -$SST -$AAPL -$AMZN -$NVDA -$TLRY -$NFLX -$QQQ -filter:retweets since_id:1510769113282580484 until_date:2022-04-05 max_tweets:10
1511029889637437448,$HMHC,Mon Apr 04 17:16:13 +0000 2022,interested to get your take on the insane volume and oi for hmhc over the past two weeks going into potential merger,False,0,0,False,"[{'text': 'HMHC', 'indices': [88, 93]}]",1,query:$HMHC -$GME -$TSLA -$TWTR -$AMC -$SPY -$DWAC -$AMD -$SST -$AAPL -$AMZN -$NVDA -$TLRY -$NFLX -$QQQ -filter:retweets since_id:1510769113282580484 until_date:2022-04-05 max_tweets:10
1511027624251777024,$HMHC,Mon Apr 04 17:07:13 +0000 2022,increasing unusual call volume hmhc ktos muln bzun clvr clvsincreasing unusual put volume clvs lw bcs gree tell vet thc,False,0,0,False,"[{'text': 'HMHC', 'indices': [32, 37]}, {'text': 'KTOS', 'indices': [38, 43]}, {'text': 'MULN', 'indices': [44, 49]}, {'text': 'BZUN', 'indices': [50, 55]}, {'text': 'CLVR', 'indices': [56, 61]}, {'text': 'CLVS', 'indices': [62, 67]}, {'text': 'CLVS', 'indices': [100, 105]}, {'text': 'LW', 'indices': [106, 109]}, {'text': 'BCS', 'indices': [110, 114]}, {'text': 'GREE', 'indices': [115, 120]}, {'text': 'TELL', 'indices': [121, 126]}, {'text': 'VET', 'indices': [127, 131]}, {'text': 'THC', 'indices': [132, 136]}]",13,query:$HMHC -$GME -$TSLA -$TWTR -$AMC -$SPY -$DWAC -$AMD -$SST -$AAPL -$AMZN -$NVDA -$TLRY -$NFLX -$QQQ -filter:retweets since_id:1510769113282580484 until_date:2022-04-05 max_tweets:10
