id,ticker,created_at,full_text_preprocessed,user.verified,favorite_count,retweet_count,quality,entities.symbols,num_cashtags,query_params
1511023540891439104,$HMHC,Mon Apr 04 16:51:00 +0000 2022,increasing unusual call volume hmhc ktos muln bzun clvr clvsincreasing unusual put volume clvs lw bcs gree tell vet thc,True,22,8,True,"[{'text': 'HMHC', 'indices': [32, 37]}, {'text': 'KTOS', 'indices': [38, 43]}, {'text': 'MULN', 'indices': [44, 49]}, {'text': 'BZUN', 'indices': [50, 55]}, {'text': 'CLVR', 'indices': [56, 61]}, {'text': 'CLVS', 'indices': [62, 67]}, {'text': 'CLVS', 'indices': [100, 105]}, {'text': 'LW', 'indices': [106, 109]}, {'text': 'BCS', 'indices': [110, 114]}, {'text': 'GREE', 'indices': [115, 120]}, {'text': 'TELL', 'indices': [121, 126]}, {'text': 'VET', 'indices': [127, 131]}, {'text': 'THC', 'indices': [132, 136]}]",13,query:$HMHC -$GME -$TSLA -$TWTR -$AMC -$SPY -$DWAC -$AMD -$SST -$AAPL -$AMZN -$NVDA -$TLRY -$NFLX -$QQQ -filter:retweets since_id:1510769113282580484 until_date:2022-04-05 max_tweets:10
1511006939513339913,$HMHC,Mon Apr 04 15:45:02 +0000 2022,houghton mifflin harcourt company current quarter revenue growth yoy of  ranked out of companies in our database hmhc,False,0,0,False,"[{'text': 'HMHC', 'indices': [159, 164]}]",1,query:$HMHC -$GME -$TSLA -$TWTR -$AMC -$SPY -$DWAC -$AMD -$SST -$AAPL -$AMZN -$NVDA -$TLRY -$NFLX -$QQQ -filter:retweets since_id:1510769113282580484 until_date:2022-04-05 max_tweets:10
1511131210201935874,$DWAC,Mon Apr 04 23:58:50 +0000 2022,thats why dwac went down today,False,1,0,False,"[{'text': 'dwac', 'indices': [38, 43]}]",1,query:$DWAC -$GME -$TSLA -$TWTR -$AMC -$SPY -$HMHC -$AMD -$SST -$AAPL -$AMZN -$NVDA -$TLRY -$NFLX -$QQQ -filter:retweets since_id:1510769113282580484 until_date:2022-04-05 max_tweets:10
1511125341917511683,$DWAC,Mon Apr 04 23:35:31 +0000 2022,ah so thats why the price went up insane why didnt he buy dwac elon musk tweets first words since becoming twitters largest shareholder  fox business,False,7,2,False,"[{'text': 'DWAC', 'indices': [62, 67]}]",1,query:$DWAC -$GME -$TSLA -$TWTR -$AMC -$SPY -$HMHC -$AMD -$SST -$AAPL -$AMZN -$NVDA -$TLRY -$NFLX -$QQQ -filter:retweets since_id:1510769113282580484 until_date:2022-04-05 max_tweets:10
1511124834926964741,$DWAC,Mon Apr 04 23:33:30 +0000 2022,now sell dwac i need to print my puts,False,2,0,False,"[{'text': 'DWAC', 'indices': [23, 28]}]",1,query:$DWAC -$GME -$TSLA -$TWTR -$AMC -$SPY -$HMHC -$AMD -$SST -$AAPL -$AMZN -$NVDA -$TLRY -$NFLX -$QQQ -filter:retweets since_id:1510769113282580484 until_date:2022-04-05 max_tweets:10
1511124734418644994,$DWAC,Mon Apr 04 23:33:06 +0000 2022,dwac kissed every level i had mapped out from this rising wedge and i didnt even take the trade myselfit be like that sometimes,False,33,1,False,"[{'text': 'DWAC', 'indices': [0, 5]}]",1,query:$DWAC -$GME -$TSLA -$TWTR -$AMC -$SPY -$HMHC -$AMD -$SST -$AAPL -$AMZN -$NVDA -$TLRY -$NFLX -$QQQ -filter:retweets since_id:1510769113282580484 until_date:2022-04-05 max_tweets:10
1511123995432669184,$DWAC,Mon Apr 04 23:30:10 +0000 2022,should have bought a stake in dwac and ruined shorts for life,False,2,0,False,"[{'text': 'DWAC', 'indices': [40, 45]}]",1,query:$DWAC -$GME -$TSLA -$TWTR -$AMC -$SPY -$HMHC -$AMD -$SST -$AAPL -$AMZN -$NVDA -$TLRY -$NFLX -$QQQ -filter:retweets since_id:1510769113282580484 until_date:2022-04-05 max_tweets:10
1511122912559915015,$DWAC,Mon Apr 04 23:25:52 +0000 2022,so we shorting dwac to lt,False,0,0,False,"[{'text': 'DWAC', 'indices': [15, 20]}]",1,query:$DWAC -$GME -$TSLA -$TWTR -$AMC -$SPY -$HMHC -$AMD -$SST -$AAPL -$AMZN -$NVDA -$TLRY -$NFLX -$QQQ -filter:retweets since_id:1510769113282580484 until_date:2022-04-05 max_tweets:10
1511122850412961795,$DWAC,Mon Apr 04 23:25:37 +0000 2022,this was doomed from inception dwac is and always was a scam,False,0,0,False,"[{'text': 'DWAC', 'indices': [68, 73]}]",1,query:$DWAC -$GME -$TSLA -$TWTR -$AMC -$SPY -$HMHC -$AMD -$SST -$AAPL -$AMZN -$NVDA -$TLRY -$NFLX -$QQQ -filter:retweets since_id:1510769113282580484 until_date:2022-04-05 max_tweets:10
1511122813163298816,$DWAC,Mon Apr 04 23:25:28 +0000 2022,cant wait for the one for dwac,False,2,0,False,"[{'text': 'DWAC', 'indices': [39, 44]}]",1,query:$DWAC -$GME -$TSLA -$TWTR -$AMC -$SPY -$HMHC -$AMD -$SST -$AAPL -$AMZN -$NVDA -$TLRY -$NFLX -$QQQ -filter:retweets since_id:1510769113282580484 until_date:2022-04-05 max_tweets:10
1511121109961383944,$DWAC,Mon Apr 04 23:18:42 +0000 2022,keep holding dwac im sure its going back to ,False,0,0,False,"[{'text': 'DWAC', 'indices': [13, 18]}]",1,query:$DWAC -$GME -$TSLA -$TWTR -$AMC -$SPY -$HMHC -$AMD -$SST -$AAPL -$AMZN -$NVDA -$TLRY -$NFLX -$QQQ -filter:retweets since_id:1510769113282580484 until_date:2022-04-05 max_tweets:10
1511119197140627466,$DWAC,Mon Apr 04 23:11:06 +0000 2022,i did something crazy todayi bought more dwaci have other stocks so its not alli was so pissed today and down i figured everyone else was toso i boughtwhat ever elon has planned will take a long timetrump just might pull this off,False,0,0,False,"[{'text': 'DWAC', 'indices': [60, 65]}]",1,query:$DWAC -$GME -$TSLA -$TWTR -$AMC -$SPY -$HMHC -$AMD -$SST -$AAPL -$AMZN -$NVDA -$TLRY -$NFLX -$QQQ -filter:retweets since_id:1510769113282580484 until_date:2022-04-05 max_tweets:10
1511130017799020549,$AMD,Mon Apr 04 23:54:06 +0000 2022,free ideas scale out when above  profitamd cgt  pltmu cgt  pltcvx cgt  pltnke cgt  plt for top secret bonus picks,False,195,14,True,"[{'text': 'AMD', 'indices': [56, 60]}, {'text': 'MU', 'indices': [93, 96]}, {'text': 'CVX', 'indices': [125, 129]}, {'text': 'NKE', 'indices': [165, 169]}]",4,query:$AMD -$GME -$TSLA -$TWTR -$AMC -$SPY -$HMHC -$DWAC -$SST -$AAPL -$AMZN -$NVDA -$TLRY -$NFLX -$QQQ -filter:retweets since_id:1510769113282580484 until_date:2022-04-05 max_tweets:10
1511128809063526403,$AMD,Mon Apr 04 23:49:18 +0000 2022,amat amd smh new article  strategas chris verrone breaks down his outlook for the semi space get all the latest amat related news here ,False,0,0,False,"[{'text': 'AMAT', 'indices': [0, 5]}, {'text': 'AMD', 'indices': [6, 10]}, {'text': 'SMH', 'indices': [11, 15]}, {'text': 'AMAT', 'indices': [141, 146]}]",4,query:$AMD -$GME -$TSLA -$TWTR -$AMC -$SPY -$HMHC -$DWAC -$SST -$AAPL -$AMZN -$NVDA -$TLRY -$NFLX -$QQQ -filter:retweets since_id:1510769113282580484 until_date:2022-04-05 max_tweets:10
1511127989613965315,$AMD,Mon Apr 04 23:46:02 +0000 2022,amd arrow minerals hones in on gold target with soil geochemistry at vranso in burkina faso,False,0,0,False,"[{'text': 'AMD', 'indices': [0, 4]}]",1,query:$AMD -$GME -$TSLA -$TWTR -$AMC -$SPY -$HMHC -$DWAC -$SST -$AAPL -$AMZN -$NVDA -$TLRY -$NFLX -$QQQ -filter:retweets since_id:1510769113282580484 until_date:2022-04-05 max_tweets:10
1511127952221622272,$AMD,Mon Apr 04 23:45:53 +0000 2022,amd treasuremap with levels posted we are long as of today,False,10,0,False,"[{'text': 'AMD', 'indices': [0, 4]}]",1,query:$AMD -$GME -$TSLA -$TWTR -$AMC -$SPY -$HMHC -$DWAC -$SST -$AAPL -$AMZN -$NVDA -$TLRY -$NFLX -$QQQ -filter:retweets since_id:1510769113282580484 until_date:2022-04-05 max_tweets:10
1511127741789315076,$AMD,Mon Apr 04 23:45:03 +0000 2022,with past performance like this how can you not sign up for a free day trial to  winning option swing trades since amd sq pypl mu,False,0,0,False,"[{'text': 'AMD', 'indices': [148, 152]}, {'text': 'SQ', 'indices': [153, 156]}, {'text': 'PYPL', 'indices': [157, 162]}, {'text': 'MU', 'indices': [163, 166]}]",4,query:$AMD -$GME -$TSLA -$TWTR -$AMC -$SPY -$HMHC -$DWAC -$SST -$AAPL -$AMZN -$NVDA -$TLRY -$NFLX -$QQQ -filter:retweets since_id:1510769113282580484 until_date:2022-04-05 max_tweets:10
1511124410421424133,$AMD,Mon Apr 04 23:31:49 +0000 2022, focus listamdsnowlcidplugalways use the indices and vix to add confluence in your decisions,False,18,2,False,"[{'text': 'AMD', 'indices': [17, 21]}, {'text': 'SNOW', 'indices': [22, 27]}, {'text': 'LCID', 'indices': [28, 33]}, {'text': 'PLUG', 'indices': [34, 39]}, {'text': 'VIX', 'indices': [67, 71]}]",5,query:$AMD -$GME -$TSLA -$TWTR -$AMC -$SPY -$HMHC -$DWAC -$SST -$AAPL -$AMZN -$NVDA -$TLRY -$NFLX -$QQQ -filter:retweets since_id:1510769113282580484 until_date:2022-04-05 max_tweets:10
1511123881892974598,$AMD,Mon Apr 04 23:29:43 +0000 2022,amd always hits different,False,0,0,False,"[{'text': 'AMD', 'indices': [0, 4]}]",1,query:$AMD -$GME -$TSLA -$TWTR -$AMC -$SPY -$HMHC -$DWAC -$SST -$AAPL -$AMZN -$NVDA -$TLRY -$NFLX -$QQQ -filter:retweets since_id:1510769113282580484 until_date:2022-04-05 max_tweets:10
1511120730154491907,$AMD,Mon Apr 04 23:17:11 +0000 2022,amd dash docu new article  jim cramer on how pandemic plays that rallied monday will perform going forward get all the latest amd related news here ,False,0,0,False,"[{'text': 'AMD', 'indices': [0, 4]}, {'text': 'DASH', 'indices': [5, 10]}, {'text': 'DOCU', 'indices': [11, 16]}, {'text': 'AMD', 'indices': [158, 162]}]",4,query:$AMD -$GME -$TSLA -$TWTR -$AMC -$SPY -$HMHC -$DWAC -$SST -$AAPL -$AMZN -$NVDA -$TLRY -$NFLX -$QQQ -filter:retweets since_id:1510769113282580484 until_date:2022-04-05 max_tweets:10
1511120019119394817,$AMD,Mon Apr 04 23:14:22 +0000 2022,amd a very popular stock thats good at shaking out active traders again and again in my opinion a much better investment than a trading stock,False,27,0,False,"[{'text': 'AMD', 'indices': [0, 4]}]",1,query:$AMD -$GME -$TSLA -$TWTR -$AMC -$SPY -$HMHC -$DWAC -$SST -$AAPL -$AMZN -$NVDA -$TLRY -$NFLX -$QQQ -filter:retweets since_id:1510769113282580484 until_date:2022-04-05 max_tweets:10
1511119151934410759,$AMD,Mon Apr 04 23:10:55 +0000 2022,definitely use this shot but while holding a glass of malortit would be much more bullish for amalgamated and bearish for barclays and lets not mention the tepid jpm note fridayguaranteed those analysts have suits on for their official headshotsamd qcom,False,0,0,False,"[{'text': 'AMD', 'indices': [261, 265]}, {'text': 'QCOM', 'indices': [266, 271]}]",2,query:$AMD -$GME -$TSLA -$TWTR -$AMC -$SPY -$HMHC -$DWAC -$SST -$AAPL -$AMZN -$NVDA -$TLRY -$NFLX -$QQQ -filter:retweets since_id:1510769113282580484 until_date:2022-04-05 max_tweets:10
1511130992794292233,$SST,Mon Apr 04 23:57:58 +0000 2022,sst climbing up on stocktwits,False,12,2,False,"[{'text': 'SST', 'indices': [0, 4]}]",1,query:$SST -$GME -$TSLA -$TWTR -$AMC -$SPY -$HMHC -$DWAC -$AMD -$AAPL -$AMZN -$NVDA -$TLRY -$NFLX -$QQQ -filter:retweets since_id:1510769113282580484 until_date:2022-04-05 max_tweets:10
1511126579832889346,$SST,Mon Apr 04 23:40:26 +0000 2022,sst someone loaded up like no other before close today,False,7,1,False,"[{'text': 'SST', 'indices': [0, 4]}]",1,query:$SST -$GME -$TSLA -$TWTR -$AMC -$SPY -$HMHC -$DWAC -$AMD -$AAPL -$AMZN -$NVDA -$TLRY -$NFLX -$QQQ -filter:retweets since_id:1510769113282580484 until_date:2022-04-05 max_tweets:10
1511126378636361729,$SST,Mon Apr 04 23:39:38 +0000 2022,sst through highs of day printing ,False,14,3,False,"[{'text': 'SST', 'indices': [0, 4]}]",1,query:$SST -$GME -$TSLA -$TWTR -$AMC -$SPY -$HMHC -$DWAC -$AMD -$AAPL -$AMZN -$NVDA -$TLRY -$NFLX -$QQQ -filter:retweets since_id:1510769113282580484 until_date:2022-04-05 max_tweets:10
1511125580388999180,$SST,Mon Apr 04 23:36:28 +0000 2022,after hours volume for sst is k  price   change  noice sst,False,8,1,False,"[{'text': 'SST', 'indices': [78, 82]}]",1,query:$SST -$GME -$TSLA -$TWTR -$AMC -$SPY -$HMHC -$DWAC -$AMD -$AAPL -$AMZN -$NVDA -$TLRY -$NFLX -$QQQ -filter:retweets since_id:1510769113282580484 until_date:2022-04-05 max_tweets:10
1511125267531542529,$SST,Mon Apr 04 23:35:13 +0000 2022,sst bitchesssss,False,6,1,False,"[{'text': 'SST', 'indices': [0, 4]}]",1,query:$SST -$GME -$TSLA -$TWTR -$AMC -$SPY -$HMHC -$DWAC -$AMD -$AAPL -$AMZN -$NVDA -$TLRY -$NFLX -$QQQ -filter:retweets since_id:1510769113282580484 until_date:2022-04-05 max_tweets:10
1511124379261935617,$SST,Mon Apr 04 23:31:42 +0000 2022,sst  up  since close and nearing ath oh man idk if im gonna be able to sleep tonight,False,16,1,False,"[{'text': 'SST', 'indices': [0, 4]}]",1,query:$SST -$GME -$TSLA -$TWTR -$AMC -$SPY -$HMHC -$DWAC -$AMD -$AAPL -$AMZN -$NVDA -$TLRY -$NFLX -$QQQ -filter:retweets since_id:1510769113282580484 until_date:2022-04-05 max_tweets:10
1511124270121897996,$SST,Mon Apr 04 23:31:15 +0000 2022, i can smelllllllll it sst aths coming,False,10,1,False,"[{'text': 'SST', 'indices': [31, 35]}]",1,query:$SST -$GME -$TSLA -$TWTR -$AMC -$SPY -$HMHC -$DWAC -$AMD -$AAPL -$AMZN -$NVDA -$TLRY -$NFLX -$QQQ -filter:retweets since_id:1510769113282580484 until_date:2022-04-05 max_tweets:10
1511124169127251971,$SST,Mon Apr 04 23:30:51 +0000 2022,after hours sst,False,7,1,False,"[{'text': 'SST', 'indices': [14, 18]}]",1,query:$SST -$GME -$TSLA -$TWTR -$AMC -$SPY -$HMHC -$DWAC -$AMD -$AAPL -$AMZN -$NVDA -$TLRY -$NFLX -$QQQ -filter:retweets since_id:1510769113282580484 until_date:2022-04-05 max_tweets:10
1511123940592209932,$SST,Mon Apr 04 23:29:57 +0000 2022,oh boy someone slap above ask on that short lol sst,False,6,1,False,"[{'text': 'SST', 'indices': [50, 54]}]",1,query:$SST -$GME -$TSLA -$TWTR -$AMC -$SPY -$HMHC -$DWAC -$AMD -$AAPL -$AMZN -$NVDA -$TLRY -$NFLX -$QQQ -filter:retweets since_id:1510769113282580484 until_date:2022-04-05 max_tweets:10
1511123358716514304,$SST,Mon Apr 04 23:27:38 +0000 2022,oh my can we close after hours at or above  sst,False,6,1,False,"[{'text': 'SST', 'indices': [52, 56]}]",1,query:$SST -$GME -$TSLA -$TWTR -$AMC -$SPY -$HMHC -$DWAC -$AMD -$AAPL -$AMZN -$NVDA -$TLRY -$NFLX -$QQQ -filter:retweets since_id:1510769113282580484 until_date:2022-04-05 max_tweets:10
1511130581379264514,$AAPL,Mon Apr 04 23:56:20 +0000 2022,aapl puts all day as iphone builds have dropped expected to fall further loop capital says,False,0,0,False,"[{'text': 'AAPL', 'indices': [0, 5]}]",1,query:$AAPL -$GME -$TSLA -$TWTR -$AMC -$SPY -$HMHC -$DWAC -$AMD -$SST -$AMZN -$NVDA -$TLRY -$NFLX -$QQQ -filter:retweets since_id:1510769113282580484 until_date:2022-04-05 max_tweets:10
1511130564224589825,$AAPL,Mon Apr 04 23:56:16 +0000 2022,aapl make amazing profit in the shortest time possiblefastest payout system friendly live supportdont miss this opportunity click on the link and join,False,0,0,False,"[{'text': 'AAPL', 'indices': [0, 5]}]",1,query:$AAPL -$GME -$TSLA -$TWTR -$AMC -$SPY -$HMHC -$DWAC -$AMD -$SST -$AMZN -$NVDA -$TLRY -$NFLX -$QQQ -filter:retweets since_id:1510769113282580484 until_date:2022-04-05 max_tweets:10
1511130121884749827,$AAPL,Mon Apr 04 23:54:31 +0000 2022,aapl wants a breakout but its got upper level resistance area from  above looks to be building volume support at this upper level though from  and netflow amp whalepositioning look promising over for long or under for short,False,0,0,False,"[{'text': 'AAPL', 'indices': [0, 5]}]",1,query:$AAPL -$GME -$TSLA -$TWTR -$AMC -$SPY -$HMHC -$DWAC -$AMD -$SST -$AMZN -$NVDA -$TLRY -$NFLX -$QQQ -filter:retweets since_id:1510769113282580484 until_date:2022-04-05 max_tweets:10
1511129944432201728,$AAPL,Mon Apr 04 23:53:48 +0000 2022,aaplbut we will be able to eliminate the count after the pullback which if would be a wave so patience will help those who do not want to risk and who want to control their risk appropriately we are in mode,False,0,0,False,"[{'text': 'aapl', 'indices': [4, 9]}]",1,query:$AAPL -$GME -$TSLA -$TWTR -$AMC -$SPY -$HMHC -$DWAC -$AMD -$SST -$AMZN -$NVDA -$TLRY -$NFLX -$QQQ -filter:retweets since_id:1510769113282580484 until_date:2022-04-05 max_tweets:10
1511128745675046913,$AAPL,Mon Apr 04 23:49:03 +0000 2022,aapl right and spx left together ,False,0,0,False,"[{'text': 'aapl', 'indices': [4, 9]}, {'text': 'spx', 'indices': [20, 24]}]",2,query:$AAPL -$GME -$TSLA -$TWTR -$AMC -$SPY -$HMHC -$DWAC -$AMD -$SST -$AMZN -$NVDA -$TLRY -$NFLX -$QQQ -filter:retweets since_id:1510769113282580484 until_date:2022-04-05 max_tweets:10
1511127510515437575,$AAPL,Mon Apr 04 23:44:08 +0000 2022, recapnile  to   didi to  lgvn to  aapl to  any to short  acer to  snmp  to  ,False,9,3,False,"[{'text': 'NILE', 'indices': [12, 17]}, {'text': 'DIDI', 'indices': [38, 43]}, {'text': 'LGVN', 'indices': [64, 69]}, {'text': 'AAPL', 'indices': [94, 99]}, {'text': 'ANY', 'indices': [122, 126]}, {'text': 'ACER', 'indices': [155, 160]}, {'text': 'SNMP', 'indices': [181, 186]}]",7,query:$AAPL -$GME -$TSLA -$TWTR -$AMC -$SPY -$HMHC -$DWAC -$AMD -$SST -$AMZN -$NVDA -$TLRY -$NFLX -$QQQ -filter:retweets since_id:1510769113282580484 until_date:2022-04-05 max_tweets:10
1511127420698464256,$AAPL,Mon Apr 04 23:43:47 +0000 2022,here is your daily chart for apple inc  aapl  trading at  aton ,False,0,1,False,"[{'text': 'AAPL', 'indices': [63, 68]}]",1,query:$AAPL -$GME -$TSLA -$TWTR -$AMC -$SPY -$HMHC -$DWAC -$AMD -$SST -$AMZN -$NVDA -$TLRY -$NFLX -$QQQ -filter:retweets since_id:1510769113282580484 until_date:2022-04-05 max_tweets:10
1511127161993928704,$AAPL,Mon Apr 04 23:42:45 +0000 2022,really aapl,False,0,0,False,"[{'text': 'AAPL', 'indices': [20, 25]}]",1,query:$AAPL -$GME -$TSLA -$TWTR -$AMC -$SPY -$HMHC -$DWAC -$AMD -$SST -$AMZN -$NVDA -$TLRY -$NFLX -$QQQ -filter:retweets since_id:1510769113282580484 until_date:2022-04-05 max_tweets:10
1511126908750213127,$AAPL,Mon Apr 04 23:41:45 +0000 2022,aapl where you at fam we doing down yet,False,0,1,False,"[{'text': 'AAPL', 'indices': [0, 5]}]",1,query:$AAPL -$GME -$TSLA -$TWTR -$AMC -$SPY -$HMHC -$DWAC -$AMD -$SST -$AMZN -$NVDA -$TLRY -$NFLX -$QQQ -filter:retweets since_id:1510769113282580484 until_date:2022-04-05 max_tweets:10
1511125492421652482,$AAPL,Mon Apr 04 23:36:07 +0000 2022,fits perfect see a pattern aapl usually invests in active businesses that have cash flow and not passive assets like bitcoin or commodities this is in line with the philosophy of their biggest institutional investors who they need to keep happy,False,0,0,False,"[{'text': 'aapl', 'indices': [55, 60]}]",1,query:$AAPL -$GME -$TSLA -$TWTR -$AMC -$SPY -$HMHC -$DWAC -$AMD -$SST -$AMZN -$NVDA -$TLRY -$NFLX -$QQQ -filter:retweets since_id:1510769113282580484 until_date:2022-04-05 max_tweets:10
1511127812660412421,$AMZN,Mon Apr 04 23:45:20 +0000 2022,spx amzn new buy signdaily time frame,False,1,0,False,"[{'text': 'SPX', 'indices': [0, 4]}, {'text': 'AMZN', 'indices': [5, 10]}]",2,query:$AMZN -$GME -$TSLA -$TWTR -$AMC -$SPY -$HMHC -$DWAC -$AMD -$SST -$AAPL -$NVDA -$TLRY -$NFLX -$QQQ -filter:retweets since_id:1510769113282580484 until_date:2022-04-05 max_tweets:10
1511126883043139589,$AMZN,Mon Apr 04 23:41:38 +0000 2022,amzn of baby products is now profitable ahead of first profitable,False,0,0,False,"[{'text': 'amzn', 'indices': [10, 15]}]",1,query:$AMZN -$GME -$TSLA -$TWTR -$AMC -$SPY -$HMHC -$DWAC -$AMD -$SST -$AAPL -$NVDA -$TLRY -$NFLX -$QQQ -filter:retweets since_id:1510769113282580484 until_date:2022-04-05 max_tweets:10
1511123972246720513,$AMZN,Mon Apr 04 23:30:04 +0000 2022,profitpacked option trades yearlydelivered to your inbox dailyfree trial and then less than day amzn googl baba msft,False,0,0,False,"[{'text': 'AMZN', 'indices': [133, 138]}, {'text': 'GOOGL', 'indices': [139, 145]}, {'text': 'BABA', 'indices': [146, 151]}, {'text': 'MSFT', 'indices': [152, 157]}]",4,query:$AMZN -$GME -$TSLA -$TWTR -$AMC -$SPY -$HMHC -$DWAC -$AMD -$SST -$AAPL -$NVDA -$TLRY -$NFLX -$QQQ -filter:retweets since_id:1510769113282580484 until_date:2022-04-05 max_tweets:10
1511120665834926090,$AMZN,Mon Apr 04 23:16:56 +0000 2022,active matters website has a page on the work they did with bb and amzn on ivy,False,3,0,False,"[{'text': 'BB', 'indices': [61, 64]}, {'text': 'AMZN', 'indices': [69, 74]}]",2,query:$AMZN -$GME -$TSLA -$TWTR -$AMC -$SPY -$HMHC -$DWAC -$AMD -$SST -$AAPL -$NVDA -$TLRY -$NFLX -$QQQ -filter:retweets since_id:1510769113282580484 until_date:2022-04-05 max_tweets:10
1511120169229246465,$AMZN,Mon Apr 04 23:14:58 +0000 2022, wish has a massive leadership problemjust buy it and beat amzn,False,0,0,False,"[{'text': 'wish', 'indices': [12, 17]}, {'text': 'amzn', 'indices': [74, 79]}]",2,query:$AMZN -$GME -$TSLA -$TWTR -$AMC -$SPY -$HMHC -$DWAC -$AMD -$SST -$AAPL -$NVDA -$TLRY -$NFLX -$QQQ -filter:retweets since_id:1510769113282580484 until_date:2022-04-05 max_tweets:10
1511117794536046592,$AMZN,Mon Apr 04 23:05:32 +0000 2022,a lot of cash on hand patience patience patience eyeing amzn ntnx aqnto nblyto pd reenter mco shw energy co others n,False,0,0,False,"[{'text': 'AMZN', 'indices': [60, 65]}, {'text': 'NTNX', 'indices': [67, 72]}, {'text': 'AQN.TO', 'indices': [74, 81]}, {'text': 'NBLY.TO', 'indices': [83, 91]}, {'text': 'PD', 'indices': [93, 96]}, {'text': 'MCO', 'indices': [108, 112]}, {'text': 'SHW', 'indices': [114, 118]}]",7,query:$AMZN -$GME -$TSLA -$TWTR -$AMC -$SPY -$HMHC -$DWAC -$AMD -$SST -$AAPL -$NVDA -$TLRY -$NFLX -$QQQ -filter:retweets since_id:1510769113282580484 until_date:2022-04-05 max_tweets:10
1511117787913146370,$AMZN,Mon Apr 04 23:05:30 +0000 2022,portfolio as of today april  v amzn docn twlo pstg tvkto bamato abnb btu uunto exeto ntnx onds mruto cnrto sark n,False,0,0,False,"[{'text': 'V', 'indices': [38, 40]}, {'text': 'AMZN', 'indices': [45, 50]}, {'text': 'DOCN', 'indices': [55, 60]}, {'text': 'TWLO', 'indices': [65, 70]}, {'text': 'PSTG', 'indices': [77, 82]}, {'text': 'TVK.TO', 'indices': [87, 94]}, {'text': 'BAM.A', 'indices': [99, 105]}, {'text': 'ABNB', 'indices': [113, 118]}, {'text': 'BTU', 'indices': [125, 129]}, {'text': 'U.UN', 'indices': [134, 139]}, {'text': 'EXE.TO', 'indices': [147, 154]}, {'text': 'NTNX', 'indices': [159, 164]}, {'text': 'ONDS', 'indices': [169, 174]}, {'text': 'MRU.TO', 'indices': [179, 186]}, {'text': 'CNR.TO', 'indices': [191, 198]}, {'text': 'SARK', 'indices': [203, 208]}]",16,query:$AMZN -$GME -$TSLA -$TWTR -$AMC -$SPY -$HMHC -$DWAC -$AMD -$SST -$AAPL -$NVDA -$TLRY -$NFLX -$QQQ -filter:retweets since_id:1510769113282580484 until_date:2022-04-05 max_tweets:10
1511117389206802433,$AMZN,Mon Apr 04 23:03:55 +0000 2022,big block flows arent trending upward for amzn similar to fb see,False,0,0,False,"[{'text': 'AMZN', 'indices': [68, 73]}, {'text': 'FB', 'indices': [85, 88]}]",2,query:$AMZN -$GME -$TSLA -$TWTR -$AMC -$SPY -$HMHC -$DWAC -$AMD -$SST -$AAPL -$NVDA -$TLRY -$NFLX -$QQQ -filter:retweets since_id:1510769113282580484 until_date:2022-04-05 max_tweets:10
1511116124611649544,$AMZN,Mon Apr 04 22:58:53 +0000 2022,how are they more profitable today with these higher operating cost and revenue declining than they were when the government was giving out free money lol btw amzn pe is over now hahah,False,1,0,False,"[{'text': 'amzn', 'indices': [159, 164]}]",1,query:$AMZN -$GME -$TSLA -$TWTR -$AMC -$SPY -$HMHC -$DWAC -$AMD -$SST -$AAPL -$NVDA -$TLRY -$NFLX -$QQQ -filter:retweets since_id:1510769113282580484 until_date:2022-04-05 max_tweets:10
1511115654493089803,$AMZN,Mon Apr 04 22:57:01 +0000 2022,jet fuel rose to a historic high today crude oil climbed   inflation is at record high and amzn jumped  today what in theee fck is going on,False,2,0,False,"[{'text': 'amzn', 'indices': [95, 100]}]",1,query:$AMZN -$GME -$TSLA -$TWTR -$AMC -$SPY -$HMHC -$DWAC -$AMD -$SST -$AAPL -$NVDA -$TLRY -$NFLX -$QQQ -filter:retweets since_id:1510769113282580484 until_date:2022-04-05 max_tweets:10
1511127282777092101,$NVDA,Mon Apr 04 23:43:14 +0000 2022,did nvda just hit the bottom of the handle on the cup and on its way into orbit,False,10,4,False,"[{'text': 'NVDA', 'indices': [4, 9]}]",1,query:$NVDA -$GME -$TSLA -$TWTR -$AMC -$SPY -$HMHC -$DWAC -$AMD -$SST -$AAPL -$AMZN -$TLRY -$NFLX -$QQQ -filter:retweets since_id:1510769113282580484 until_date:2022-04-05 max_tweets:10
1511125073003888642,$NVDA,Mon Apr 04 23:34:27 +0000 2022,wl clf mp ftnt crwd avgo aa achr cf cost lac lxu mdb mos nue nvda panw x great action today i dont see as much high quality setup for tomorrow more metalsferts type stuff off scans into tomorrow,False,8,0,False,"[{'text': 'CLF', 'indices': [3, 7]}, {'text': 'MP', 'indices': [8, 11]}, {'text': 'FTNT', 'indices': [12, 17]}, {'text': 'CRWD', 'indices': [18, 23]}, {'text': 'AVGO', 'indices': [24, 29]}, {'text': 'AA', 'indices': [30, 33]}, {'text': 'ACHR', 'indices': [34, 39]}, {'text': 'CF', 'indices': [40, 43]}, {'text': 'COST', 'indices': [44, 49]}, {'text': 'LAC', 'indices': [50, 54]}, {'text': 'LXU', 'indices': [55, 59]}, {'text': 'MDB', 'indices': [60, 64]}, {'text': 'MOS', 'indices': [65, 69]}, {'text': 'NUE', 'indices': [70, 74]}, {'text': 'NVDA', 'indices': [75, 80]}, {'text': 'PANW', 'indices': [81, 86]}, {'text': 'X', 'indices': [87, 89]}]",17,query:$NVDA -$GME -$TSLA -$TWTR -$AMC -$SPY -$HMHC -$DWAC -$AMD -$SST -$AAPL -$AMZN -$TLRY -$NFLX -$QQQ -filter:retweets since_id:1510769113282580484 until_date:2022-04-05 max_tweets:10
1511124725682089987,$NVDA,Mon Apr 04 23:33:04 +0000 2022,nvda was the th most mentioned on wallstreetbets over the last daysvia,False,0,0,False,"[{'text': 'NVDA', 'indices': [0, 5]}]",1,query:$NVDA -$GME -$TSLA -$TWTR -$AMC -$SPY -$HMHC -$DWAC -$AMD -$SST -$AAPL -$AMZN -$TLRY -$NFLX -$QQQ -filter:retweets since_id:1510769113282580484 until_date:2022-04-05 max_tweets:10
1511124659596496896,$NVDA,Mon Apr 04 23:32:48 +0000 2022,nvda  today but lagged overall with the rest of the marketampema squeeze going into tomorrow,False,2,1,False,"[{'text': 'NVDA', 'indices': [0, 5]}]",1,query:$NVDA -$GME -$TSLA -$TWTR -$AMC -$SPY -$HMHC -$DWAC -$AMD -$SST -$AAPL -$AMZN -$TLRY -$NFLX -$QQQ -filter:retweets since_id:1510769113282580484 until_date:2022-04-05 max_tweets:10
1511124493833539588,$NVDA,Mon Apr 04 23:32:09 +0000 2022,nvda new article  nvidias auto software opportunity is underappreciated says wells fargo get all the latest nvda related news here ,False,1,0,False,"[{'text': 'NVDA', 'indices': [0, 5]}, {'text': 'NVDA', 'indices': [136, 141]}]",2,query:$NVDA -$GME -$TSLA -$TWTR -$AMC -$SPY -$HMHC -$DWAC -$AMD -$SST -$AAPL -$AMZN -$TLRY -$NFLX -$QQQ -filter:retweets since_id:1510769113282580484 until_date:2022-04-05 max_tweets:10
